{
  "$schema": "host-api.schema.json",
  "language": "AuroraScript",
  "versionTarget": "4.0.0",
  "assemblies": ["AuroraScript.JIT"],
  "namespaces": [
    "AuroraScript",
    "AuroraScript.Compiler",
    "AuroraScript.Core",
    "AuroraScript.Source",
    "AuroraScript.Runtime",
    "AuroraScript.Runtime.Interop",
    "AuroraScript.Runtime.Package",
    "AuroraScript.Runtime.Serialization",
    "AuroraScript.Runtime.Types",
    "AuroraScript.Hosting"
  ],
  "types": {
    "AuroraEngine": {
      "kind": "class",
      "namespace": "AuroraScript",
      "summary": "Primary host entry point for compiling scripts, creating domains, and compiling lightweight blocks.",
      "members": {
        "Constructor": {
          "kind": "constructor",
          "signature": "AuroraEngine(EngineOptions options)",
          "summary": "Creates an engine with immutable compiler, runtime, optimization, output, and native-module options."
        },
        "Global": {
          "kind": "field",
          "signature": "ScriptGlobal Global",
          "summary": "Engine-level global prototype used by new domains."
        },
        "ClrRegistry": {
          "kind": "field",
          "signature": "ClrTypeRegistry ClrRegistry",
          "summary": "Host-side registry for CLR types exposed to scripts."
        },
        "BuildAsync": {
          "kind": "method",
          "summary": "Compiles modules and their import/include graph.",
          "overloads": [
            "Task BuildAsync(params ScriptSource[] sources)",
            "Task BuildAsync(CancellationToken cancellationToken = default)",
            "Task BuildAsync(string entryPath, CancellationToken cancellationToken = default)",
            "Task BuildAsync(IEnumerable<string> entryPaths, CancellationToken cancellationToken = default)",
            "Task BuildAsync(CancellationToken cancellationToken, params ScriptSource[] sources)"
          ],
          "notes": [
            "BuildAsync(string) resolves the entry path through Compiler.SourceResolver.",
            "BuildAsync() enumerates all sources from Compiler.SourceResolver.GetAllSourcesAsync.",
            "Before module analysis, the compiler scans resolver-visible project .as files and loads standalone @global() declaration files when they exist.",
            "@global() declarations are optional compile-time contracts for host globals and do not depend on import/include.",
            "Enabled built-in bare paths resolve before project sources; relative imports continue to use the project resolver.",
            "Resolved ScriptSourceReference.FullPath is the identity used for module graphs and runtime registration.",
            "Sources without @module are anonymous; no default name is derived from a filename or path.",
            "Only explicit @module names participate in name-conflict checks. An explicit project name that collides with another project module or an enabled built-in module fails during linking."
          ]
        },
        "CompileBlock": {
          "kind": "method",
          "summary": "Compiles a function body for direct invocation.",
          "overloads": [
            "CompiledBlock CompileBlock(string source, string[] parameters)",
            "CompiledBlock CompileBlock(string source, CompileBlockOptions options = null)"
          ],
          "notes": [
            "CompileBlock accepts a function body with optional leading imports of already loaded user modules or enabled extension packages. It does not create a runtime module or read dependency sources.",
            "Imports require CompileBlockOptions.Domain from the same engine; aliases are read-only. Native/const members can bind directly, while mutable members remain dynamic.",
            "CompileBlock does not support @module, @global(), include, export, or declare."
          ]
        },
        "CreateDomain": {
          "kind": "method",
          "summary": "Creates an initialized execution domain for compiled modules.",
          "overloads": [
            "ScriptDomain CreateDomain(Action<ScriptGlobal> globalConfiguration, ScriptObject userState = null)",
            "ScriptDomain CreateDomain(ScriptGlobal domainGlobal = null, ScriptObject userState = null)"
          ]
        },
        "CreateEmptyDomain": {
          "kind": "method",
          "signature": "ScriptDomain CreateEmptyDomain(Action<ScriptGlobal> globalConfiguration, ScriptObject userState = null)",
          "summary": "Creates a domain without running the compiled module initializer."
        },
        "NewEnvironment": {
          "kind": "method",
          "signature": "ScriptGlobal NewEnvironment()",
          "summary": "Creates a global environment inheriting from the engine global."
        }
      }
    },
    "EngineOptions": {
      "kind": "record",
      "namespace": "AuroraScript",
      "summary": "Immutable root configuration for compiler, runtime, optimization, output, opt-in native modules, and engine-scoped native types.",
      "members": {
        "Default": {
          "kind": "field",
          "signature": "static readonly EngineOptions Default"
        },
        "Runtime": {
          "kind": "property",
          "signature": "RuntimeOptions Runtime"
        },
        "Compiler": {
          "kind": "property",
          "signature": "CompilerOptions Compiler"
        },
        "Optimization": {
          "kind": "property",
          "signature": "OptimizationOptions Optimization"
        },
        "Output": {
          "kind": "property",
          "signature": "OutputOptions Output"
        },
        "Packages": {
          "kind": "property",
          "signature": "IReadOnlyList<NativePackageDefinition> Packages",
          "summary": "Extension packages explicitly enabled for this engine. Empty by default. Packages are importable and are not registered on the script global."
        },
        "WithCompiler": {
          "kind": "method",
          "signature": "EngineOptions WithCompiler(Action<CompilerOptionsBuilder> configure)"
        },
        "WithRuntime": {
          "kind": "method",
          "signature": "EngineOptions WithRuntime(Action<RuntimeOptionsBuilder> configure)"
        },
        "WithOptimization": {
          "kind": "method",
          "signature": "EngineOptions WithOptimization(Action<OptimizationOptionsBuilder> configure)"
        },
        "WithOutput": {
          "kind": "method",
          "signature": "EngineOptions WithOutput(Action<OutputOptionsBuilder> configure)"
        },
        "WithPackages": {
          "kind": "method",
          "signature": "EngineOptions WithPackages(Action<NativePackagesBuilder> configure)",
          "summary": "Returns a new immutable options snapshot with extension package selections applied."
        }
      }
    },
    "NativePackageDefinition": {
      "kind": "class",
      "namespace": "AuroraScript.Core",
      "summary": "Immutable definition for an opt-in NativePackage generated from [NativeType] + [NativePackage].",
      "notes": [
        "Construct from a generated package type. The type must be a sealed top-level ScriptObject with [NativeType] and [NativePackage], and must expose the generated RegisterPackage method. Do not register that type with WithNativeTypes.",
        "Module names must be non-keyword AuroraScript identifiers.",
        "Import paths are normalized bare relative paths and cannot contain . or .. segments.",
        "Packages are not registered on the script global."
      ],
      "members": {
        "Constructor": {
          "kind": "constructor",
          "signature": "NativePackageDefinition(Type nativeType)"
        },
        "Name": {
          "kind": "property",
          "signature": "string Name",
          "summary": "Explicit lookup name used by host module APIs and script global.getModule."
        },
        "ModulePath": {
          "kind": "property",
          "signature": "string ModulePath"
        },
        "TypeName": {
          "kind": "property",
          "signature": "string TypeName",
          "summary": "HostExportCatalog key. Not a script global name."
        },
        "NativeType": {
          "kind": "property",
          "signature": "Type NativeType"
        }
      }
    },
    "NativePackagesBuilder": {
      "kind": "class",
      "namespace": "AuroraScript.Core",
      "summary": "Mutable builder used by EngineOptions.WithPackages.",
      "members": {
        "Constructor": {
          "kind": "constructor",
          "signature": "NativePackagesBuilder(IReadOnlyList<NativePackageDefinition> definitions)"
        },
        "Add": {
          "kind": "method",
          "overloads": [
            "NativePackagesBuilder Add(NativePackageDefinition definition)",
            "NativePackagesBuilder Add(Type nativeType)",
            "NativePackagesBuilder Add<T>()"
          ]
        },
        "Clear": {
          "kind": "method",
          "signature": "NativePackagesBuilder Clear()"
        }
      }
    },
    "NativePackages": {
      "kind": "factory",
      "namespace": "AuroraScript.Core",
      "summary": "Catalog of NativePackages shipped with AuroraScript.",
      "members": {
        "FileSystem": {
          "kind": "property",
          "signature": "static NativePackageDefinition FileSystem",
          "summary": "Enables the fs package and its file-system APIs."
        },
        "HttpClient": {
          "kind": "property",
          "signature": "static NativePackageDefinition HttpClient",
          "summary": "Enables the http package and its synchronous and callback-based HTTP APIs."
        }
      }
    },
    "RuntimeOptions": {
      "kind": "record",
      "namespace": "AuroraScript",
      "summary": "Runtime behavior used while scripts execute.",
      "members": {
        "Default": {
          "kind": "field",
          "signature": "static readonly RuntimeOptions Default"
        },
        "EnableHotReload": {